{
  "$schema": "https://raw.githubusercontent.com/Azure/Azure-Landing-Zones-Library/main/schemas/archetype_definition.json",
  "name": "amba_connectivity",
  "policy_assignments": [
    "Deploy-AMBA-Connectivity"
  ],
  "policy_definitions": [],
  "policy_set_definitions": [],
  "role_definitions": []
}
