{
  "name": "root",
  "policy_assignments": [
    "Audit-ResourceRGLocation",
    "Audit-UnusedResources",
    "Audit-ZoneResiliency",
    "Deny-Classic-Resources",
    "Deny-UnmanagedDisk",
    "Deploy-ASC-Monitoring",
    "Deploy-AzActivity-Log",
    "Deploy-MDEndpoints",
    "Deploy-MDFC-Config",
    "Deploy-MDFC-OssDb",
    "Deploy-MDFC-SqlAtp",
    "Deploy-Resource-Diag",
    "Enforce-ACSB"
  ],
  "policy_definitions": [
    "Append-AppService-httpsonly",
    "Append-AppService-latestTLS",
    "Append-KV-SoftDelete",
    "Append-Redis-disableNonSslPort",
    "Append-Redis-sslEnforcement",
    "Audit-AzureHybridBenefit",
    "Audit-Disks-UnusedResourcesCostOptimization",
    "Audit-MachineLearning-PrivateEndpointId",
    "Audit-PrivateLinkDnsZones",
    "Audit-PublicIpAddresses-UnusedResourcesCostOptimization",
    "Audit-ServerFarms-UnusedResourcesCostOptimization",
    "Deny-AA-child-resources",
    "Deny-AppGW-Without-WAF",
    "Deny-AppServiceApiApp-http",
    "Deny-AppServiceFunctionApp-http",
    "Deny-AppServiceWebApp-http",
    "Deny-Databricks-NoPublicIp",
    "Deny-Databricks-Sku",
    "Deny-Databricks-VirtualNetwork",
    "Deny-FileServices-InsecureAuth",
    "Deny-FileServices-InsecureKerberos",
    "Deny-FileServices-InsecureSmbChannel",
    "Deny-FileServices-InsecureSmbVersions",
    "Deny-MachineLearning-Aks",
    "Deny-MachineLearning-Compute-SubnetId",
    "Deny-MachineLearning-Compute-VmSize",
    "Deny-MachineLearning-ComputeCluster-RemoteLoginPortPublicAccess",
    "Deny-MachineLearning-ComputeCluster-Scale",
    "Deny-MachineLearning-HbiWorkspace",
    "Deny-MachineLearning-PublicAccessWhenBehindVnet",
    "Deny-MachineLearning-PublicNetworkAccess",
    "Deny-MgmtPorts-From-Internet",
    "Deny-MySql-http",
    "Deny-PostgreSql-http",
    "Deny-Private-DNS-Zones",
    "Deny-PublicEndpoint-MariaDB",
    "Deny-PublicIP",
    "Deny-RDP-From-Internet",
    "Deny-Redis-http",
    "Deny-Sql-minTLS",
    "Deny-SqlMi-minTLS",
    "Deny-Storage-minTLS",
    "Deny-Storage-SFTP",
    "Deny-StorageAccount-CustomDomain",
    "Deny-Subnet-Without-Nsg",
    "Deny-Subnet-Without-Penp",
    "Deny-Subnet-Without-Udr",
    "Deny-UDR-With-Specific-NextHop",
    "Deny-VNET-Peer-Cross-Sub",
    "Deny-VNET-Peering-To-Non-Approved-VNETs",
    "Deny-VNet-Peering",
    "DenyAction-ActivityLogs",
    "DenyAction-DiagnosticLogs",
    "Deploy-ASC-SecurityContacts",
    "Deploy-Budget",
    "Deploy-Custom-Route-Table",
    "Deploy-DDoSProtection",
    "Deploy-Diagnostics-AA",
    "Deploy-Diagnostics-ACI",
    "Deploy-Diagnostics-ACR",
    "Deploy-Diagnostics-AnalysisService",
    "Deploy-Diagnostics-ApiForFHIR",
    "Deploy-Diagnostics-APIMgmt",
    "Deploy-Diagnostics-ApplicationGateway",
    "Deploy-Diagnostics-AVDScalingPlans",
    "Deploy-Diagnostics-Bastion",
    "Deploy-Diagnostics-CDNEndpoints",
    "Deploy-Diagnostics-CognitiveServices",
    "Deploy-Diagnostics-CosmosDB",
    "Deploy-Diagnostics-Databricks",
    "Deploy-Diagnostics-DataExplorerCluster",
    "Deploy-Diagnostics-DataFactory",
    "Deploy-Diagnostics-DLAnalytics",
    "Deploy-Diagnostics-EventGridSub",
    "Deploy-Diagnostics-EventGridSystemTopic",
    "Deploy-Diagnostics-EventGridTopic",
    "Deploy-Diagnostics-ExpressRoute",
    "Deploy-Diagnostics-Firewall",
    "Deploy-Diagnostics-FrontDoor",
    "Deploy-Diagnostics-Function",
    "Deploy-Diagnostics-HDInsight",
    "Deploy-Diagnostics-iotHub",
    "Deploy-Diagnostics-LoadBalancer",
    "Deploy-Diagnostics-LogAnalytics",
    "Deploy-Diagnostics-LogicAppsISE",
    "Deploy-Diagnostics-MariaDB",
    "Deploy-Diagnostics-MediaService",
    "Deploy-Diagnostics-MlWorkspace",
    "Deploy-Diagnostics-MySQL",
    "Deploy-Diagnostics-NetworkSecurityGroups",
    "Deploy-Diagnostics-NIC",
    "Deploy-Diagnostics-PostgreSQL",
    "Deploy-Diagnostics-PowerBIEmbedded",
    "Deploy-Diagnostics-RedisCache",
    "Deploy-Diagnostics-Relay",
    "Deploy-Diagnostics-SignalR",
    "Deploy-Diagnostics-SQLElasticPools",
    "Deploy-Diagnostics-SQLMI",
    "Deploy-Diagnostics-TimeSeriesInsights",
    "Deploy-Diagnostics-TrafficManager",
    "Deploy-Diagnostics-VirtualNetwork",
    "Deploy-Diagnostics-VM",
    "Deploy-Diagnostics-VMSS",
    "Deploy-Diagnostics-VNetGW",
    "Deploy-Diagnostics-VWanS2SVPNGW",
    "Deploy-Diagnostics-WebServerFarm",
    "Deploy-Diagnostics-Website",
    "Deploy-Diagnostics-WVDAppGroup",
    "Deploy-Diagnostics-WVDHostPools",
    "Deploy-Diagnostics-WVDWorkspace",
    "Deploy-FirewallPolicy",
    "Deploy-MDFC-Arc-SQL-DCR-Association",
    "Deploy-MDFC-Arc-Sql-DefenderSQL-DCR",
    "Deploy-MDFC-SQL-AMA",
    "Deploy-MDFC-SQL-DefenderSQL-DCR",
    "Deploy-MDFC-SQL-DefenderSQL",
    "Deploy-MySQL-sslEnforcement",
    "Deploy-Nsg-FlowLogs-to-LA",
    "Deploy-Nsg-FlowLogs",
    "Deploy-PostgreSQL-sslEnforcement",
    "Deploy-Sql-AuditingSettings",
    "Deploy-SQL-minTLS",
    "Deploy-Sql-SecurityAlertPolicies",
    "Deploy-Sql-Tde",
    "Deploy-Sql-vulnerabilityAssessments_20230706",
    "Deploy-Sql-vulnerabilityAssessments",
    "Deploy-SqlMi-minTLS",
    "Deploy-Storage-sslEnforcement",
    "Deploy-UserAssignedManagedIdentity-VMInsights",
    "Deploy-Vm-autoShutdown",
    "Deploy-VNET-HubSpoke",
    "Deploy-Windows-DomainJoin"
  ],
  "policy_set_definitions": [
    "Audit-UnusedResourcesCostOptimization",
    "Deny-PublicPaaSEndpoints",
    "DenyAction-DeleteProtection",
    "Deploy-AUM-CheckUpdates",
    "Deploy-Diagnostics-LogAnalytics",
    "Deploy-MDFC-Config",
    "Deploy-MDFC-DefenderSQL-AMA",
    "Deploy-Private-DNS-Zones",
    "Deploy-Sql-Security",
    "Enforce-ACSB",
    "Enforce-ALZ-Decomm",
    "Enforce-ALZ-Sandbox",
    "Enforce-Encryption-CMK",
    "Enforce-EncryptTransit",
    "Enforce-Guardrails-KeyVault"
  ],
  "role_definitions": [
    "Network-Subnet-Contributor",
    "Application-Owners",
    "Network-Management",
    "Security-Operations",
    "Subscription-Owner"
  ]
}
