{
  "name": "platform",
  "policy_assignments": [
    "Deploy-MDFC-DefenSQL-AMA",
    "Deploy-VM-ChangeTrack",
    "Deploy-VM-Monitoring",
    "Deploy-vmArc-ChangeTrack",
    "Deploy-VMSS-ChangeTrack",
    "Deploy-VMSS-Monitoring",
    "Enable-AUM-CheckUpdates",
    "Enforce-GR-KeyVault"
  ],
  "policy_definitions": [],
  "policy_set_definitions": [],
  "role_definitions": []
}
