{
  "$schema": "https://raw.githubusercontent.com/Azure/Azure-Landing-Zones-Library/main/schemas/archetype_definition.json",
  "name": "landing_zones",
  "policy_assignments": [
    "Audit-AppGW-WAF",
    "Deny-IP-forwarding",
    "Deny-MgmtPorts-Internet",
    "Deny-Priv-Esc-AKS",
    "Deny-Privileged-AKS",
    "Deny-Storage-http",
    "Deny-Subnet-Without-Nsg",
    "Deploy-AzSqlDb-Auditing",
    "Deploy-MDFC-DefSQL-AMA",
    "Deploy-SQL-TDE",
    "Deploy-SQL-Threat",
    "Deploy-VM-Backup",
    "Deploy-VM-ChangeTrack",
    "Deploy-VM-Monitoring",
    "Deploy-vmArc-ChangeTrack",
    "Deploy-vmHybr-Monitoring",
    "Deploy-VMSS-ChangeTrack",
    "Deploy-VMSS-Monitoring",
    "Enable-AUM-CheckUpdates",
    "Enable-DDoS-VNET",
    "Enforce-AKS-HTTPS",
    "Enforce-ASR",
    "Enforce-Encrypt-CMK0",
    "Enforce-GR-APIM0",
    "Enforce-GR-AppServices0",
    "Enforce-GR-Automation0",
    "Enforce-GR-BotService0",
    "Enforce-GR-CogServ0",
    "Enforce-GR-Compute0",
    "Enforce-GR-ContApps0",
    "Enforce-GR-ContInst0",
    "Enforce-GR-ContReg0",
    "Enforce-GR-CosmosDb0",
    "Enforce-GR-DataExpl0",
    "Enforce-GR-DataFactory0",
    "Enforce-GR-EventGrid0",
    "Enforce-GR-EventHub0",
    "Enforce-GR-KeyVault",
    "Enforce-GR-KeyVaultSup0",
    "Enforce-GR-Kubernetes0",
    "Enforce-GR-MachLearn0",
    "Enforce-GR-MySQL0",
    "Enforce-GR-Network0",
    "Enforce-GR-OpenAI0",
    "Enforce-GR-PostgreSQL0",
    "Enforce-GR-ServiceBus0",
    "Enforce-GR-SQL0",
    "Enforce-GR-Storage0",
    "Enforce-GR-Synapse0",
    "Enforce-GR-VirtualDesk0",
    "Enforce-Subnet-Private",
    "Enforce-TLS-SSL-Q225"
  ],
  "policy_definitions": [],
  "policy_set_definitions": [],
  "role_definitions": []
}
